{
  "$id": "https://github.com/nitishsjsucs/peoplelake/contracts/raw-record.schema.json",
  "$schema": "https://json-schema.org/draft/2020-12/schema",
  "type": "object",
  "properties": {
    "event_id": {
      "type": "string",
      "pattern": "^[0-9a-f]{8}-[0-9a-f]{4}-[0-9a-f]{4}-[0-9a-f]{4}-[0-9a-f]{12}$"
    },
    "source": {
      "type": "string",
      "enum": [
        "hris",
        "ats",
        "talent"
      ]
    },
    "event_type": {
      "type": "string",
      "minLength": 1
    },
    "entity_id": {
      "type": "string",
      "minLength": 1
    },
    "source_sequence": {
      "type": "integer",
      "minimum": 0,
      "maximum": 9007199254740991
    },
    "source_updated_at": {
      "type": "string",
      "pattern": "^\\d{4}-\\d{2}-\\d{2}T\\d{2}:\\d{2}:\\d{2}(\\.\\d{1,6})?Z$"
    },
    "effective_date": {
      "type": "string",
      "pattern": "^\\d{4}-\\d{2}-\\d{2}$"
    },
    "schema_version": {
      "type": "integer",
      "minimum": 1,
      "maximum": 2147483647
    },
    "payload": {
      "type": "string"
    },
    "payload_sha256": {
      "type": "string",
      "pattern": "^[0-9a-f]{64}$"
    },
    "received_at": {
      "type": "string",
      "pattern": "^\\d{4}-\\d{2}-\\d{2}T\\d{2}:\\d{2}:\\d{2}(\\.\\d{1,6})?Z$"
    },
    "delivery_id": {
      "type": "string",
      "pattern": "^[0-9a-f]{8}-[0-9a-f]{4}-[0-9a-f]{4}-[0-9a-f]{4}-[0-9a-f]{12}$"
    },
    "ingest_request_id": {
      "type": "string",
      "minLength": 1
    },
    "producer": {
      "type": "string",
      "minLength": 1
    }
  },
  "required": [
    "event_id",
    "source",
    "event_type",
    "entity_id",
    "source_sequence",
    "source_updated_at",
    "effective_date",
    "schema_version",
    "payload",
    "payload_sha256",
    "received_at",
    "delivery_id",
    "ingest_request_id",
    "producer"
  ],
  "additionalProperties": false
}
